{
  "$schema": "./build.schema.json",
  "DependDBProjectImportNotificationMailAddress": "nonexistent@nonexistent.nonexistent",
  "VcsUrlTemplate": "https://raw.githubusercontent.com/re-motion/Framework/develop/{0}",
  "Target": [ "CIBuild" ],
  "TestConfigurations": [ "Debug"],
  "TestExecutionRuntimes": [ "LocalMachine" ],
  "TestPlatforms": [ "x86" ],
  "TestTargetRuntimes": [ "NET10_0", "NET11_0" ],
  "TestBrowsers": [ "NoBrowser" ],
  "TestSqlServers": [ "SqlServerDefault" ]
}