{
  "$schema": "./build.schema.json",
  "Solution": "Remotion.sln",
  "DependDBProjectName": "re-motion Framework",
  "DependDBRetentionTime": "30",
  "DependDBProjectBranch": "Main",
  "DependDBProjectImportNotificationMailAddressCc": "",
  "DependDBTrackedReferences": "Remotion;Remotion.*",
  "DependDBNugetConfig": "~/nuget.config",
  "DependDBTargetFramework": "net8.0-windows"
}
